[
  {
    "id": "app.wechat",
    "displayName": "微信",
    "tier": "A",
    "iconAsset": "/icons/third_party/wechat.png",
    "deviceAvailability": [
      "investigation",
      "player"
    ],
    "initialRoute": "root",
    "routes": [
      {
        "id": "route.app.wechat.root",
        "path": "root",
        "scrollRestoration": true
      }
    ],
    "capabilities": [
      "open",
      "back",
      "refresh_restore"
    ],
    "reference": {
      "packVersion": "1.0-full",
      "appSlug": "wechat",
      "stateIds": [],
      "modeByState": {}
    }
  },
  {
    "id": "app.photos",
    "displayName": "照片",
    "tier": "A",
    "iconAsset": "/icons/system/photos.png",
    "deviceAvailability": [
      "investigation",
      "player"
    ],
    "initialRoute": "root",
    "routes": [
      {
        "id": "route.app.photos.root",
        "path": "root",
        "scrollRestoration": true
      }
    ],
    "capabilities": [
      "open",
      "back",
      "refresh_restore"
    ],
    "reference": {
      "packVersion": "1.0-full",
      "appSlug": "photos",
      "stateIds": [],
      "modeByState": {}
    }
  },
  {
    "id": "app.safari",
    "displayName": "Safari",
    "tier": "A",
    "iconAsset": "/icons/system/safari.png",
    "deviceAvailability": [
      "investigation",
      "player"
    ],
    "initialRoute": "root",
    "routes": [
      {
        "id": "route.app.safari.root",
        "path": "root",
        "scrollRestoration": true
      }
    ],
    "capabilities": [
      "open",
      "back",
      "refresh_restore"
    ],
    "reference": {
      "packVersion": "1.0-full",
      "appSlug": "safari",
      "stateIds": [],
      "modeByState": {}
    }
  },
  {
    "id": "app.baidu_map",
    "displayName": "百度地图",
    "tier": "A",
    "iconAsset": "/icons/third_party/baidu_map.png",
    "deviceAvailability": [
      "investigation",
      "player"
    ],
    "initialRoute": "root",
    "routes": [
      {
        "id": "route.app.baidu_map.root",
        "path": "root",
        "scrollRestoration": true
      }
    ],
    "capabilities": [
      "open",
      "back",
      "refresh_restore"
    ],
    "reference": {
      "packVersion": "1.0-full",
      "appSlug": "baidu_map",
      "stateIds": [],
      "modeByState": {}
    }
  },
  {
    "id": "app.phone",
    "displayName": "电话",
    "tier": "A",
    "iconAsset": "/icons/system/phone.png",
    "deviceAvailability": [
      "investigation",
      "player"
    ],
    "initialRoute": "root",
    "routes": [
      {
        "id": "route.app.phone.root",
        "path": "root",
        "scrollRestoration": true
      }
    ],
    "capabilities": [
      "open",
      "back",
      "refresh_restore"
    ],
    "reference": {
      "packVersion": "1.0-full",
      "appSlug": "phone",
      "stateIds": [],
      "modeByState": {}
    }
  },
  {
    "id": "app.files",
    "displayName": "文件",
    "tier": "A",
    "iconAsset": "/icons/system/files.png",
    "deviceAvailability": [
      "investigation",
      "player"
    ],
    "initialRoute": "root",
    "routes": [
      {
        "id": "route.app.files.root",
        "path": "root",
        "scrollRestoration": true
      }
    ],
    "capabilities": [
      "open",
      "back",
      "refresh_restore"
    ],
    "reference": {
      "packVersion": "1.0-full",
      "appSlug": "files",
      "stateIds": [],
      "modeByState": {}
    }
  },
  {
    "id": "app.notes",
    "displayName": "备忘录",
    "tier": "A",
    "iconAsset": "/icons/system/notes.png",
    "deviceAvailability": [
      "investigation",
      "player"
    ],
    "initialRoute": "root",
    "routes": [
      {
        "id": "route.app.notes.root",
        "path": "root",
        "scrollRestoration": true
      }
    ],
    "capabilities": [
      "open",
      "back",
      "refresh_restore"
    ],
    "reference": {
      "packVersion": "1.0-full",
      "appSlug": "notes",
      "stateIds": [],
      "modeByState": {}
    }
  },
  {
    "id": "app.calendar",
    "displayName": "日历",
    "tier": "B",
    "iconAsset": "/icons/system/calendar.png",
    "deviceAvailability": [
      "investigation",
      "player"
    ],
    "initialRoute": "root",
    "routes": [
      {
        "id": "route.app.calendar.root",
        "path": "root",
        "scrollRestoration": true
      }
    ],
    "capabilities": [
      "open",
      "back",
      "refresh_restore"
    ],
    "reference": {
      "packVersion": "1.0-full",
      "appSlug": "calendar",
      "stateIds": [],
      "modeByState": {}
    }
  },
  {
    "id": "app.settings",
    "displayName": "设置",
    "tier": "A",
    "iconAsset": "/icons/system/settings.png",
    "deviceAvailability": [
      "investigation",
      "player"
    ],
    "initialRoute": "root",
    "routes": [
      {
        "id": "route.app.settings.root",
        "path": "root",
        "scrollRestoration": true
      }
    ],
    "capabilities": [
      "open",
      "back",
      "refresh_restore"
    ],
    "reference": {
      "packVersion": "1.0-full",
      "appSlug": "settings",
      "stateIds": [],
      "modeByState": {}
    }
  },
  {
    "id": "app.xiaohongshu",
    "displayName": "小红书",
    "tier": "B",
    "iconAsset": "/icons/third_party/xiaohongshu.png",
    "deviceAvailability": [
      "investigation",
      "player"
    ],
    "initialRoute": "root",
    "routes": [
      {
        "id": "route.app.xiaohongshu.root",
        "path": "root",
        "scrollRestoration": true
      }
    ],
    "capabilities": [
      "open",
      "back",
      "refresh_restore"
    ],
    "reference": {
      "packVersion": "1.0-full",
      "appSlug": "xiaohongshu",
      "stateIds": [],
      "modeByState": {}
    }
  },
  {
    "id": "app.douyin",
    "displayName": "抖音",
    "tier": "B",
    "iconAsset": "/icons/third_party/douyin.png",
    "deviceAvailability": [
      "investigation",
      "player"
    ],
    "initialRoute": "root",
    "routes": [
      {
        "id": "route.app.douyin.root",
        "path": "root",
        "scrollRestoration": true
      }
    ],
    "capabilities": [
      "open",
      "back",
      "refresh_restore"
    ],
    "reference": {
      "packVersion": "1.0-full",
      "appSlug": "douyin",
      "stateIds": [],
      "modeByState": {}
    }
  },
  {
    "id": "app.zhihu",
    "displayName": "知乎",
    "tier": "B",
    "iconAsset": "/icons/third_party/zhihu.png",
    "deviceAvailability": [
      "investigation",
      "player"
    ],
    "initialRoute": "root",
    "routes": [
      {
        "id": "route.app.zhihu.root",
        "path": "root",
        "scrollRestoration": true
      }
    ],
    "capabilities": [
      "open",
      "back",
      "refresh_restore"
    ],
    "reference": {
      "packVersion": "1.0-full",
      "appSlug": "zhihu",
      "stateIds": [],
      "modeByState": {}
    }
  },
  {
    "id": "app.tieba",
    "displayName": "百度贴吧",
    "tier": "B",
    "iconAsset": "/icons/third_party/tieba.png",
    "deviceAvailability": [
      "investigation",
      "player"
    ],
    "initialRoute": "root",
    "routes": [
      {
        "id": "route.app.tieba.root",
        "path": "root",
        "scrollRestoration": true
      }
    ],
    "capabilities": [
      "open",
      "back",
      "refresh_restore"
    ],
    "reference": {
      "packVersion": "1.0-full",
      "appSlug": "tieba",
      "stateIds": [],
      "modeByState": {}
    }
  },
  {
    "id": "app.toutiao",
    "displayName": "今日头条",
    "tier": "B",
    "iconAsset": "/icons/third_party/toutiao.png",
    "deviceAvailability": [
      "investigation",
      "player"
    ],
    "initialRoute": "root",
    "routes": [
      {
        "id": "route.app.toutiao.root",
        "path": "root",
        "scrollRestoration": true
      }
    ],
    "capabilities": [
      "open",
      "back",
      "refresh_restore"
    ],
    "reference": {
      "packVersion": "1.0-full",
      "appSlug": "toutiao",
      "stateIds": [],
      "modeByState": {}
    }
  },
  {
    "id": "app.qqmail",
    "displayName": "QQ邮箱",
    "tier": "B",
    "iconAsset": "/icons/third_party/qqmail.png",
    "deviceAvailability": [
      "investigation",
      "player"
    ],
    "initialRoute": "root",
    "routes": [
      {
        "id": "route.app.qqmail.root",
        "path": "root",
        "scrollRestoration": true
      }
    ],
    "capabilities": [
      "open",
      "back",
      "refresh_restore"
    ],
    "reference": {
      "packVersion": "1.0-full",
      "appSlug": "qqmail",
      "stateIds": [],
      "modeByState": {}
    }
  },
  {
    "id": "app.baidunetdisk",
    "displayName": "百度网盘",
    "tier": "B",
    "iconAsset": "/icons/third_party/baidunetdisk.png",
    "deviceAvailability": [
      "investigation",
      "player"
    ],
    "initialRoute": "root",
    "routes": [
      {
        "id": "route.app.baidunetdisk.root",
        "path": "root",
        "scrollRestoration": true
      }
    ],
    "capabilities": [
      "open",
      "back",
      "refresh_restore"
    ],
    "reference": {
      "packVersion": "1.0-full",
      "appSlug": "baidunetdisk",
      "stateIds": [],
      "modeByState": {}
    }
  },
  {
    "id": "app.alipay",
    "displayName": "支付宝",
    "tier": "B",
    "iconAsset": "/icons/third_party/alipay.png",
    "deviceAvailability": [
      "investigation",
      "player"
    ],
    "initialRoute": "root",
    "routes": [
      {
        "id": "route.app.alipay.root",
        "path": "root",
        "scrollRestoration": true
      }
    ],
    "capabilities": [
      "open",
      "back",
      "refresh_restore"
    ],
    "reference": {
      "packVersion": "1.0-full",
      "appSlug": "alipay",
      "stateIds": [],
      "modeByState": {}
    }
  },
  {
    "id": "app.didi",
    "displayName": "滴滴出行",
    "tier": "C",
    "iconAsset": "/icons/third_party/didi.png",
    "deviceAvailability": [
      "investigation",
      "player"
    ],